id,title,genres,authors,description,readers_count,avg_rating,genre_score
136012,Обманщик-газетчик и легковерный читатель,"Зарубежная классика,Литература 19 века,Русская классика",Михаил Салтыков-Щедрин,"жанр: сатирическая повесть
темы: общество, мораль, коррупция, власть, политика, пресса
конфликт: Противоречие между обманом и правдой, между тем, что заявляется и что существует на самом деле.
смысл: Повесть описывает взаимоотношения между газетчиком, который обманывает своих читателей, и легковерным читателем, который верит всему, что написано в газете.",15,4.2,898
23271,Оборона Семидворья,"Литература 20 века,Русская классика,Советская литература,Книги о войне",Андрей Платонов,"жанр: повесть
темы: война, героизм, выживание, оборона, семья
конфликт: Противостояние захватчикам, борьба за выживание.
смысл: Повесть описывает события обороны села.",14,4.7,898
57848,Оборотень,"Литература 20 века,Русская классика",Дмитрий Мамин-Сибиряк,"жанр: повесть
темы: оборотень, деревня, общество
конфликт: столкновение человека и существа
смысл: Описание жизни в деревне и встречи с оборотнем.",16,5.0,898
316618,Обручение Даши,"Литература 20 века,Русская классика",Валерий Брюсов,"жанр: повесть
темы: любовь, выбор, мораль, внутренний конфликт, идентичность
конфликт: столкновение желаний и долга, внутренние противоречия героини
смысл: повесть о сложностях выбора и самопознания героини.",13,5.0,898
15001,Обыкновенная история,"Литература 19 века,Русская классика",Иван Гончаров,"жанр: роман
темы: взросление, семья, любовь, одиночество, внутренний конфликт
конфликт: столкновение идеалов и реальности, противоречия в отношениях
смысл: роман рассказывает о жизни молодого человека, анализирующего свои отношения и место в обществе.",14,4.0,898
49167,Обыкновенный человек,Русская классика,Алексей Толстой,"жанр: роман
темы: семья, любовь, внутренний конфликт, идентичность, мораль
конфликт: противоречия в личности, внутренние трудности
смысл: роман о жизни и внутренних переживаниях человека.",11,4.0,898
236321,О марте. Об апреле. О мае. Об июне и июле. Об августе,"Литература 19 века,Русская классика",Антон Чехов,"жанр: классическая проза
темы: семья, взросление, одиночество, смысл жизни, внутренний конфликт
конфликт: противоречия в жизни и чувствах, поиск смысла
смысл: Описание жизни и переживаний человека в разные месяцы, размышления о смысле жизни.",11,5.0,898
128015,О пребывании Пушкина на Кавказе в 1829 году,"Литература 19 века,Русская классика",Евгений Вейденбаум,"жанр: историческая проза
темы: история, литература, Кавказ
конфликт: нет информации
смысл: В книге описано пребывание Пушкина на Кавказе в 1829 году.",16,4.8,898
95083,Дневник Сатаны,"Литература 20 века,Русская классика",Леонид Андреев,"жанр: философская проза
темы: смысл жизни, добро и зло, внутренний конфликт, идентичность, мораль
конфликт: Противоречие между добром и злом, поиск смысла жизни
смысл: Книга представляет собой размышления о природе добра и зла, смысле жизни и внутреннем конфликте человека.",18,4.0,898
199104,Дневник лишнего человека,"Литература 19 века,Русская классика",Иван Тургенев,"жанр: повесть
темы: одиночество, внутренний конфликт, самопознание, идентичность, смысл жизни
конфликт: внутренний конфликт героя, поиск смысла жизни
смысл: Герой повести ведет дневник, в котором описывает свои мысли и чувства, пытаясь понять себя и свое место в жизни. Повесть рассказывает о поиске смысла жизни и преодолении внутреннего конфликта.",49,4.8,898
115190,Дни Турбиных,"Пьесы и драматургия,Литература 20 века,Русская классика",Михаил Булгаков,"жанр: роман
темы: семья, взросление, внутренний конфликт, мораль, власть
конфликт: столкновение с реальностью, кризис ценностей
смысл: Описание жизни семьи интеллигентов в переломный момент истории. Отображение сложностей адаптации к новым условиям.",231,4.8,898
8777,Дни и ночи,"Литература 20 века,Русская классика,Советская литература,Книги о войне",Константин Симонов,"жанр: роман
темы: война, любовь, семья, выживание, героизм
конфликт: Противоречия военного времени, столкновение с опасностью.
смысл: Описание военных событий и их влияние на людей.",10,5.0,898
181907,Дети солнца,"Пьесы и драматургия,Русская классика",Максим Горький,"жанр: повесть
темы: семья, дети, взросление
конфликт: противоречия взросления
смысл: описание жизни и взросления детей в определённой среде",20,5.0,898
37277,Детство,"Литература 20 века,Русская классика",Максим Горький,"жанр: повесть
темы: детство, семья, взросление
конфликт: сложные отношения в семье, трудности взросления
смысл: Описание жизни и воспитания ребёнка в сложной семье.",20,4.0,898
227155,Детство Люверс,"Литература 20 века,Русская классика,Советская литература",Борис Пастернак,"жанр: повесть
темы: детство, взросление, семья, одиночество, самопознание
конфликт: столкновение с реальностью, поиск своего места
смысл: Описание взросления и формирования личности в переломный момент жизни.",14,3.5,898
80355,Детство Никиты,"Литература 20 века,Русская классика",Алексей Толстой,"жанр: повесть
темы: детство, взросление, семья, одиночество, самопознание
конфликт: формирование личности в детстве, преодоление трудностей
смысл: Описание детства и взросления Никиты, становление его личности.",20,4.8,898
24571,Детство Тёмы,"Литература 20 века,Русская классика",Николай Гарин-Михайловский,"жанр: повесть
темы: детство, взросление, семья, одиночество, внутренний конфликт
конфликт: столкновение с реальностью, преодоление страха
смысл: Описание взросления и формирования личности мальчика.",15,5.0,898
213571,Детство. Отрочество. После бала. Кавказский пленник,"Литература 19 века,Русская классика",Лев Толстой,"жанр: классическая проза
темы: детство, взросление, семья, мораль, внутренний конфликт
конфликт: противоречия взросления, столкновение идеалов и реальности
смысл: Описание этапов взросления и становления личности.",18,4.3,898
234024,Довольно,Русская классика,Иван Тургенев,"жанр: повесть
темы: любовь, свобода, выбор, внутренний конфликт, смысл жизни
конфликт: противоречия в отношениях, поиск смысла
смысл: повесть о сложностях человеческих отношений и поиске жизненного пути.",11,5.0,898
43454,Дожить до рассвета,"Зарубежная классика,Современная зарубежная литература,Литература 20 века,Русская классика,Советская литература,Книги о войне",Василий Быков,"жанр: повесть
темы: война, выживание, героизм, долг, честь
конфликт: Противостояние с врагом, борьба за выживание.
смысл: Повесть о событиях на войне, о героических поступках и испытаниях.",40,4.7,898
128165,Дознание,"Литература 19 века,Русская классика",Александр Куприн,"жанр: повесть
темы: война, смерть, страдание, героизм, долг, честь
конфликт: Противоречия на войне, военные действия
смысл: Описание военных событий, изображение героизма и долга.",10,4.0,898
319878,Доктор Живаго,"Литература 20 века,Русская классика,Советская литература",Борис Пастернак,"жанр: роман
темы: любовь, внутренний конфликт, смысл жизни, идентичность, революция, общество
конфликт: Противоречие между личными ценностями и общественными требованиями. Конфликт между индивидуальной свободой и социальными нормами.
смысл: Роман рассказывает о жизни и судьбе доктора Живаго в переломный момент истории России.",188,4.9,898
219164,Докучаев,"Литература 20 века,Русская классика",Владимир Гиляровский,"жанр: биография
темы: жизнь, личность, история
конфликт: жизненные трудности, преодоление
смысл: Описание жизни и деятельности Владимира Докучаева.",13,4.8,898
107313,Дикие,Русская классика,Леонид Добычин,"жанр: повесть
темы: взросление, одиночество, внутренний конфликт, семья, эмоции
конфликт: противоречия взросления, поиск своего места
смысл: описание процесса взросления и поиска идентичности в советское время.",13,4.7,898
107946,Дипломатия,"Литература 19 века,Русская классика",Максим Горький,"жанр: пьеса
темы: политика, дипломатия, общество
конфликт: столкновение интересов, борьба за власть
смысл: изображение дипломатических отношений и их влияния на общество",11,5.0,898
237179,О самарском голоде,"Старинная литература,Русская классика",Лев Толстой,"жанр: публицистика
темы: голод, Самарская губерния, Российская империя
конфликт: голод и его последствия
смысл: описание голода в Самарской губернии и его влияние на население",14,5.0,898
10067,"О том, о сём",Русская классика,Антон Чехов,"жанр: классическая проза
темы: жизнь, общество, человек, отношения, мораль, смысл жизни
конфликт: социальные противоречия, внутренний конфликт
смысл: произведение описывает жизнь и быт людей, заставляет задуматься о смысле жизни.",20,5.0,898
73447,Об искусстве,"Старинная литература,Русская классика",Лев Толстой,"жанр: эссе
темы: искусство, творчество, эстетика, культура, смысл жизни
конфликт: противоречия в понимании искусства
смысл: Рассуждения о сущности искусства и его роли в жизни человека.",10,5.0,898
33678,Старые портреты,"Литература 19 века,Русская классика",Иван Тургенев,"жанр: повесть
темы: семья, взросление, одиночество, смысл жизни, внутренний конфликт
конфликт: противоречия между прошлым и настоящим, поиск смысла жизни
смысл: повесть о поиске смысла жизни и своего места в обществе.",13,5.0,898
291803,Старый гений,"Литература 19 века,Русская классика",Николай Лесков,"жанр: повесть
темы: мораль, вина, прощение, смысл жизни, внутренний конфликт, идентичность
конфликт: противоречие между внутренним миром и внешними обстоятельствами
смысл: повесть о сложной судьбе человека, столкнувшегося с несправедливостью и пытающегося найти выход из трудной ситуации.",20,4.1,898
138684,Старый знакомый,"Литература 20 века,Русская классика",Николай Бунин,"жанр: рассказ
темы: встреча, знакомство, отношения
конфликт: встреча со старым знакомым, переосмысление прошлого
смысл: рассказ о встрече, которая заставляет переосмыслить прошлое и настоящее.",14,,898
187372,Степа,Русская классика,Иван Бунин,"жанр: рассказ
темы: семья, детство, взросление
конфликт: столкновение с реальностью, поиск своего места
смысл: Описание жизни и взросления Степы, рассказ о его семье и детстве.",14,5.0,898
80957,Степан Сергеич,Русская классика,Викентий Вересаев,"жанр: повесть
темы: взросление, семья, внутренний конфликт, идентичность, самопознание
конфликт: противоречия в отношениях с отцом, поиск своего места в жизни
смысл: повесть о взрослении и поиске своего пути в жизни.",20,4.6,898
173134,Степной король Лир,"Литература 19 века,Русская классика",Иван Тургенев,"жанр: повесть
темы: семья, власть, предательство, честь, долг, внутренний конфликт
конфликт: борьба за власть и признание
смысл: Повесть рассказывает о жизни и судьбе главного героя, анализируя его отношения с окружающими и обществом.",17,4.0,898
67549,Степные волки,"Литература 19 века,Русская классика",Алексей Будищев,"жанр: повесть
темы: одиночество, страдание, вина, смысл жизни, внутренний конфликт
конфликт: противоречия в душе героя, поиск смысла жизни
смысл: описание душевных переживаний и поиска смысла жизни главного героя.",17,5.0,898
277124,Степь,"Зарубежная классика,Литература 19 века,Русская классика",Антон Чехов,"жанр: классическая проза
темы: одиночество, природа, смысл жизни, страдание, выживание
конфликт: поиск смысла жизни в условиях страдания и одиночества
смысл: Описание жизни в степи и отражение внутреннего состояния человека.",22,4.0,898
5289,Стихи о прекрасной даме,"Старинная литература,Русская классика",Александр Блок,"жанр: классическая поэзия
темы: любовь, красота, духовность
конфликт: противоречия между идеалом и реальностью
смысл: Отражение внутреннего мира и идеализированной любви в поэзии.",13,5.0,898
227065,Стихотворения 1817—1822,"Старинная литература,Русская классика",Александр Пушкин,"жанр: классическая поэзия
темы: любовь, свобода, творчество, самопознание, внутренний конфликт
конфликт: противоречия в жизни и творчестве, поиск смысла
смысл: Отражение жизни и внутреннего мира через поэзию, исследование мыслей и чувств.",13,4.0,898
309221,Стихотворения 1910 - 1915,"Старинная литература,Русская классика",Сергей Есенин,"жанр: классическая поэзия
темы: любовь, страдание, смысл жизни, одиночество, смерть
конфликт: внутренний конфликт, поиск смысла
смысл: Поэзия отражает внутренний мир и эмоциональные переживания лирического героя. Стихотворения передают чувства и мысли автора через поэтические образы и метафоры.",14,,898
186016,Храбрые беглецы,"Литература 20 века,Русская классика",Александр Куприн,"жанр: приключения
темы: героизм, выживание, опасность, предательство, честь, долг
конфликт: Противостояние добра и зла, борьба за выживание.
смысл: Книга рассказывает о приключениях и подвигах людей, которые борются за свою жизнь и честь в сложных обстоятельствах.",10,5.0,898
83218,Христианское учение,"Старинная литература,Русская классика",Лев Толстой,"жанр: философская проза
темы: смысл жизни, мораль, добро и зло, внутренний конфликт, самопознание, духовность
конфликт: поиск истины, противоречия в понимании христианства
смысл: книга описывает философские и духовные искания Льва Толстого, связанные с пониманием христианства и его роли в жизни человека.",13,5.0,898
206454,Дом у Старого Пимена,"Литература 20 века,Русская классика",Марина Цветаева,"жанр: мемуары
темы: семья, детство, взросление
конфликт: воспоминания о прошлом, детские переживания
смысл: Воспоминания о детском и юношеском периоде жизни в Москве, в доме у Старого Пимена.",11,5.0,898
132361,Дома,"Литература 19 века,Русская классика",Антон Чехов,"жанр: повесть
темы: семья, дом, отношения
конфликт: проблемы в семье, недовольство жизнью
смысл: Описание жизни в доме и взаимоотношений его обитателей.",14,,898
127092,Дон Жуан,"Старинная литература,Русская классика",Алексей Толстой,"жанр: повесть
темы: любовь, мораль, внутренний конфликт, свобода, выбор
конфликт: столкновение со своими желаниями, борьба с моральными принципами
смысл: Описание жизни и похождений легендарного героя, анализ его характера.",13,5.0,898
89015,Дориан Грей,Русская классика,Леонид Добычин,"жанр: роман
темы: идентичность, внутренний конфликт, мораль, добро и зло, самопознание
конфликт: противоречие между добром и злом, внутренний конфликт героя
смысл: роман о внутреннем мире человека и его борьбе с самим собой.",10,4.0,898
232397,Достигаев и другие,"Пьесы и драматургия,Литература 20 века,Русская классика",Максим Горький,"жанр: роман
темы: семья, власть, предательство, смысл жизни, выбор, мораль
конфликт: столкновение интересов, внутренние противоречия
смысл: описание жизни общества и личностей в переломный момент истории, исследование человеческих отношений и выборов.",19,3.0,898
