id,title,genres,authors,description,readers_count,avg_rating,genre_score
71319,"1001 день, или Новая Шахерезада","Литература 20 века,Русская классика","Илья Ильф,Евгений Петров","жанр: сатира
темы: любовь, власть, коррупция, социальное неравенство, обман
конфликт: борьба за власть, социальные противоречия
смысл: история о борьбе за власть и социальных противоречиях, рассказанная в сатирическом ключе.",19,4.5,898
7926,Сергей Есенин,"Литература 20 века,Русская классика",Максим Горький,"жанр: биография
темы: жизнь, творчество, литература
конфликт: нет информации
смысл: Книга представляет собой биографический очерк о жизни и творчестве Сергея Есенина.",11,2.0,898
80078,Святая ложь,"Литература 20 века,Русская классика",Александр Куприн,"жанр: повесть
темы: мораль, вина, прощение, внутренний конфликт, идентичность, психология личности
конфликт: столкновение с прошлым, поиск истины
смысл: Описание событий, связанных с раскрытием обмана и их последствиями. Осмысление роли прошлого в жизни человека.",11,5.0,898
154258,Святочный рассказ,"Литература 19 века,Русская классика",Михаил Салтыков-Щедрин,"жанр: классическая проза
темы: Рождество, праздник, семья, традиция, общество
конфликт: противоречия между реальностью и идеалом
смысл: рассказ о событиях в канун Рождества.",15,5.0,898
84195,Сгущенное молоко,Русская классика,Варлам Шаламов,"жанр: повесть
темы: выживание, лагерь, свобода
конфликт: Заключение в лагерь, борьба за выживание.
смысл: Повесть о переживаниях в советском трудовом лагере.",10,5.0,898
93976,Себастиян Бах,"Литература 19 века,Русская классика",Владимир Одоевский,"жанр: повесть
темы: музыка, талант, судьба
конфликт: противоречия между реальностью и мечтой, столкновение таланта и обыденности
смысл: повесть о судьбе и жизненном пути талантливого музыканта.",13,5.0,898
78650,Севастополь в августе 1855 года,"Старинная литература,Русская классика",Лев Толстой,"жанр: классическая проза
темы: война, героизм, выживание, опасность, предательство, честь
конфликт: военные действия, противостояние сторон
смысл: Описание событий в Севастополе во время обороны города. Отображение хода военных действий и положения дел в армии.",16,4.7,898
261024,Севастополь в декабре месяце,"Старинная литература,Русская классика",Лев Толстой,"жанр: классическая проза
темы: война, смерть, страдание, героизм, долг, честь
конфликт: военные действия, человеческие потери
смысл: Описание военных событий и их влияние на людей.",14,5.0,898
54414,Севастопольские рассказы,"Литература 19 века,Русская классика",Лев Толстой,"жанр: классическая проза
темы: война, героизм, смерть, страдание, выживание
конфликт: Противоречия военного времени, столкновение жизни и смерти.
смысл: Описание военных событий и их влияние на людей. Передача атмосферы военного времени.",67,4.8,898
27971,Сашка Жегулев,Русская классика,Леонид Андреев,"жанр: повесть
темы: революция, насилие, конфликт, героизм, предательство, власть
конфликт: Противоречия между революционерами и властью, внутренние разногласия среди революционеров.
смысл: Повесть описывает события, связанные с революцией и её последствиями.",19,5.0,898
92206,Свадьба,"Зарубежная классика,Литература 19 века,Русская классика",Максим Горький,"жанр: повесть
темы: семья, любовь, выбор, общество, традиции
конфликт: противоречия на свадьбе
смысл: описание событий на свадьбе и реакции персонажей",13,5.0,898
223269,Авторская исповедь,"Литература 19 века,Русская классика",Николай Гоголь,"жанр: эссе
темы: семья, вина, прощение, смысл жизни, идентичность
конфликт: внутренний конфликт, противоречие между идеалами и реальностью
смысл: Авторская исповедь представляет собой размышления о жизни и творчестве, исследование внутреннего мира и поиск смысла существования.",10,3.7,898
4432,"Ада, или Радости страсти","Зарубежная классика,Литература 20 века,Русская классика",Владимир Набоков,"жанр: роман
темы: любовь, семья, идентичность, эмоции, отношения
конфликт: внутренний конфликт, семейные противоречия
смысл: исследование сложностей человеческих отношений и эмоций, изучение семейной динамики и личностного роста.",23,4.5,898
61431,Адское пламя,"Литература 20 века,Русская классика",Иван Ефремов,"жанр: научная фантастика
темы: космос, эволюция, биология
конфликт: противоречие между прогрессом и опасностью
смысл: исследование последствий научных открытий, борьба за выживание в космосе",18,4.8,898
95821,Азартные игры в старину,"Литература 19 века,Русская классика",Михаил Пыляев,"жанр: исторический роман
темы: азарт, игры, история, общество, традиции
конфликт: социальное неравенство, конфликт интересов
смысл: Описание жизни и азартных игр в прошлом, социальные аспекты игровой культуры.",13,5.0,898
252708,Акварель,"Зарубежная классика,Литература 20 века,Русская классика",Александр Грин,"жанр: роман
темы: любовь, семья, одиночество
конфликт: внутренний конфликт, социальные нормы
смысл: История о поиске смысла жизни, исследование человеческих отношений и эмоций.",10,4.5,898
161904,Алатырь,"Литература 20 века,Русская классика",Евгений Замятин,"жанр: фэнтези
темы: любовь, власть, идентичность, свобода, конфликт
конфликт: борьба за власть, внутренний конфликт
смысл: исследование человеческой природы, поиск смысла жизни",17,3.0,898
292471,Алгебра,Русская классика,Семен Юшкевич,"жанр: роман
темы: семья, одиночество, самопознание
конфликт: внутренний конфликт, конфликт поколений
смысл: История о поиске себя и понимании отношений, исследование внутреннего мира героя.",24,4.0,898
39213,Алмазная карта,"Литература 20 века,Русская классика",Варлам Шаламов,"жанр: рассказ
темы: одиночество, страдание, выживание, опасность, конфликт
конфликт: борьба за выживание, внутренний конфликт
смысл: история о выживании и внутренней борьбе, рассказывающая о человеческой способности к сопротивлению и стойкости в экстремальных условиях.",15,4.5,898
104721,Алёша-дурачок,"Литература 19 века,Русская классика",Леонид Андреев,"жанр: рассказ
темы: семья, вина, прощение
конфликт: внутренний конфликт, конфликт
смысл: История о человеке, который проходит через процесс самопознания и прощения, смысл жизни и свободы выбора.",11,5.0,898
166507,Амена,"Литература 19 века,Русская классика",Алексей Толстой,"жанр: исторический роман
темы: любовь, семья, власть, революция, война
конфликт: борьба за власть, социальные изменения
смысл: история о жизни и борьбе людей в период социальных потрясений, исследование человеческих отношений и конфликтов в условиях войны и революции.",10,5.0,898
147795,Анатэма,"Пьесы и драматургия,Русская классика",Леонид Андреев,"жанр: рассказ
темы: вина, прощение, смысл жизни, страдание, смерть
конфликт: внутренний конфликт, моральный конфликт
смысл: История о поиске смысла жизни и борьбе с внутренними муками, исследование тем вины и прощения.",12,5.0,898
289279,Анафема,"Литература 20 века,Русская классика",Александр Куприн,"жанр: рассказ
темы: семья, вина, прощение
конфликт: внутренний конфликт, семейные противоречия
смысл: История о сложных семейных отношениях и поиске прощения, исследует темы вины и внутреннего конфликта.",12,3.7,898
239480,Ангелочек,"Литература 19 века,Русская классика",Леонид Андреев,"жанр: рассказ
темы: любовь, семья, смерть
конфликт: внутренний конфликт, конфликт
смысл: История о сложных отношениях и эмоциях, исследующая человеческую природу.",18,3.8,898
298911,Андрей Колосов,"Литература 19 века,Русская классика",Иван Тургенев,"жанр: роман
темы: любовь, семья, одиночество, вина, прощение
конфликт: внутренний конфликт, социальные противоречия
смысл: История жизни Андрея Колосова, исследование его внутреннего мира и отношений с окружающими.",15,4.5,898
7143,Светлана,"Старинная литература,Русская классика",Василий Жуковский,NO DESCRIPTION,28,5.0,898
70076,Светлая личность,"Литература 20 века,Русская классика","Илья Ильф,Евгений Петров","жанр: повесть
темы: смысл жизни, идентичность, самопознание, внутренний конфликт, мораль
конфликт: поиск смысла жизни, преодоление внутреннего конфликта
смысл: Герой ищет свой путь и пытается понять себя и свое место в жизни. Повесть описывает его внутренние переживания и поиск смысла.",14,4.0,898
185394,Свидание,"Зарубежная классика,Литература 19 века,Русская классика",Максим Горький,"жанр: рассказ
темы: любовь, одиночество, внутренний конфликт, самопознание, отношения
конфликт: Противоречия в отношениях, эмоциональный конфликт
смысл: Рассказ о встрече и взаимоотношениях двух людей, анализ их эмоций и ожиданий.",14,4.0,898
51840,Свободная любовь,Русская классика,Лев Толстой,"жанр: роман
темы: любовь, свобода, выбор, мораль, внутренний конфликт
конфликт: противоречия между личными желаниями и социальными нормами
смысл: роман описывает сложности человеческих отношений и поиска смысла жизни.",13,4.7,898
259540,Свои люди – сочтемся,"Пьесы и драматургия,Литература 19 века,Русская классика",Александр Островский,"жанр: пьеса
темы: семья, общество, мораль, деньги, отношения
конфликт: столкновение интересов, борьба за наследство
смысл: Пьеса рассказывает о жизни купеческой семьи и взаимоотношениях её членов.",54,4.9,898
101806,"Свои собаки грызутся, чужая не приставай","Старинная литература,Русская классика",Александр Островский,"жанр: повесть
темы: семья, конфликт, власть, социальные нормы, мораль
конфликт: Противоречия между членами семьи и социальными ожиданиями.
смысл: Повесть описывает сложные взаимоотношения в семье и обществе.",13,5.0,898
122715,Ряженые,"Литература 19 века,Русская классика",Алексей Будищев,"жанр: повесть
темы: общество, мораль, внутренний конфликт, идентичность, выбор
конфликт: Противоречия между внешними ожиданиями и внутренними убеждениями. 
смысл: Герои повести сталкиваются с необходимостью выбора между лицемерным благополучием и честностью перед собой и обществом.",8,5.0,898
204985,С голоду,"Литература 19 века,Русская классика",Дмитрий Мамин-Сибиряк,"жанр: повесть
темы: голод, выживание, семья, дети, общество
конфликт: Голод и нужда против человеческих сил и духа.
смысл: Повесть описывает жизнь людей в условиях голода и трудностей.",18,5.0,898
222133,Самоцветы,"Литература 19 века,Русская классика",Дмитрий Мамин-Сибиряк,"жанр: повесть
темы: семья, дети, выживание
конфликт: Отношения между старателями и детьми
смысл: Повесть о приключениях детей в тайге.",19,4.6,898
263933,Сатиры,"Старинная литература,Русская классика",Саша Чёрный,"жанр: сатира
темы: общество, мораль, внутренний конфликт, власть, коррупция
конфликт: противоречия в обществе, критика власти
смысл: произведение содержит критический взгляд на общество и власть.",15,5.0,898
33305,Сестры,"Литература 20 века,Русская классика",Викентий Вересаев,"жанр: повесть
темы: семья, взросление, выбор, внутренний конфликт, отношения
конфликт: Противоречия между сестрами, выбор жизненного пути.
смысл: Повесть о взаимоотношениях сестёр и их выборе в жизни.",17,5.0,898
112818,Сигнал,"Литература 19 века,Русская классика",Всеволод Гаршин,"жанр: рассказ
темы: одиночество, смерть, вина, прощение, смысл жизни
конфликт: внутренний конфликт героя, столкновение с реальностью
смысл: рассказ о судьбе человека, столкнувшегося с трагическими обстоятельствами. Герой переживает сложный внутренний конфликт.",17,4.7,898
30722,Синодальный философ,"Литература 19 века,Русская классика",Николай Лесков,"жанр: философская проза
темы: смысл жизни, внутренний конфликт, самопознание, идентичность, мораль
конфликт: поиск истины, внутренние противоречия
смысл: произведение о поиске смысла жизни и самопознании.",13,5.0,898
259557,Язвительный,"Литература 19 века,Русская классика",Николай Лесков,"жанр: повесть
темы: мораль, внутренний конфликт, самопознание, идентичность, психология личности
конфликт: противоречия в личности, поиск смысла
смысл: описание внутреннего мира человека, анализ его мыслей и чувств",10,4.5,898
60156,Яма,"Литература 20 века,Русская классика",Александр Куприн,"жанр: повесть
темы: любовь, проституция, одиночество, вина, мораль, внутренний конфликт
конфликт: столкновение с жестокой реальностью, внутренний разлад
смысл: Описание жизни проституток и их внутреннего мира.",257,4.9,898
61579,…И всему роду твоему,Русская классика,Константин Воробьев,"жанр: повесть
темы: война, выживание, героизм, предательство, семья
конфликт: Противоречия в условиях военного времени, проблема выживания.
смысл: Повествование о военных событиях и судьбах людей в условиях войны. Описание военных действий и их влияния на персонажей.",16,3.0,898
150216,Анна Владимировна,Русская классика,Викентий Вересаев,"жанр: роман
темы: семья, любовь, одиночество, страдание, прощение
конфликт: внутренний конфликт, семейные противоречия
смысл: История жизни Анны Владимировны, ее борьба и поиск смысла жизни. Описание ее отношений и внутренних конфликтов.",21,4.8,898
169853,Анна Каренина,"Литература 19 века,Русская классика",Лев Толстой,"жанр: роман
темы: любовь, семья, вина, прощение, смысл жизни
конфликт: внутренний конфликт, социальные нормы
смысл: История о жизни и отношениях Анны Карениной, исследующая темы любви, семьи и социальных норм. Роман раскрывает внутренние конфликты и борьбу персонажей за смысл жизни.",827,4.8,898
272281,Анна на шее,"Литература 19 века,Русская классика",Антон Чехов,"жанр: рассказ
темы: любовь, семья, одиночество
конфликт: внутренний конфликт, социальные нормы
смысл: История о поиске счастья и самоопределении, исследование человеческих отношений и социальных ожиданий.",76,4.5,898
232619,Антигона,Русская классика,Иван Бунин,"жанр: драма
темы: семья, вина, прощение, смерть, конфликт
конфликт: внутренний конфликт, социальный конфликт
смысл: История о борьбе личности с общественными нормами, исследование человеческих отношений и конфликтов.",20,4.2,898
25212,Антоша Чехонте,"Литература 20 века,Русская классика",Владимир Гиляровский,"жанр: биография
темы: детство, дружба, семья, идентичность, отношения
конфликт: внутренний конфликт, конфликт поколений
смысл: Описание жизни Антоши Чехонте, его отношений и внутренних конфликтов. Изучение его идентичности и места в обществе.",21,4.8,898
87978,Анфиса,"Пьесы и драматургия,Русская классика",Леонид Андреев,"жанр: рассказ
темы: любовь, семья, вина
конфликт: внутренний конфликт, конфликт отношений
смысл: История о сложных отношениях и внутренних конфликтах, исследующая темы любви и вины.",22,4.7,898
114185,Апельсины,"Зарубежная классика,Литература 20 века,Русская классика",Александр Грин,"жанр: фэнтези
темы: любовь, свобода, идентичность, выживание, опасность
конфликт: внутренний конфликт, конфликт с обществом
смысл: История о поиске смысла жизни и самоопределении, разворачивающаяся в фантастическом мире.",15,5.0,898
