id,title,genres,authors,description,readers_count,avg_rating,genre_score
54024,Колхида,"Литература 20 века,Русская классика,Советская литература",Константин Паустовский,"жанр: исторический роман
темы: история, прошлое, цивилизация, социальные процессы
конфликт: противоречие между прошлым и настоящим, борьба за сохранение культурного наследия.
смысл: Книга ""Колхида"" представляет собой исторический роман, в котором автор исследует прошлое и культуру Колхиды, подчеркивая важность сохранения культурного наследия и преодоления противоречий между прошлым и настоящим.",16,5.0,898
144697,Лев старца Герасима,"Литература 19 века,Русская классика",Николай Лесков,"жанр: классическая проза
темы: семья, взросление, смысл жизни, власть
конфликт: противоречие между старшим и младшим поколениями, борьба за власть и влияние.
смысл: Книга исследует проблемы взросления и поиска смысла жизни, а также отношения между старшим и младшим поколениями в традиционном обществе.",11,,898
304212,Левушка,Русская классика,Лидия Чарская,"жанр: приключения
темы: путешествия, путь героя, приключение, открытия, исследование
конфликт: главный герой сталкивается с опасностями и препятствиями на пути к цели.
смысл: книга рассказывает о приключениях главного героя и его поисках знаний и опыта.",9,5.0,898
219847,Легенда о смерти Александра I,"Литература 20 века,Русская классика",П. Бунин,"жанр: исторический роман
темы: история, Россия, император, смерть, власть
конфликт: противоречие между личностью императора и его ролью в истории.
смысл: книга представляет собой исторический роман, в котором автор исследует жизнь и смерть императора Александра I, подчеркивая сложности его личности и политической власти.",17,5.0,898
9935,Легкое дыхание,Русская классика,Иван Бунин,"жанр: классическая проза
темы: любовь, смерть, вина, смысл жизни
конфликт: противоречие между индивидуальной свободой и социальными нормами.
смысл: Книга исследует проблемы человеческой природы и поиска смысла в жизни.",28,4.5,898
12672,Товарищи,"Литература 19 века,Русская классика",Викентий Вересаев,"жанр: исторический роман
темы: семья, взросление, власть, социальное неравенство
конфликт: противоречие между социальными классами и стремлением к равенству.
смысл: Книга рассказывает о жизни и борьбе людей в определенный исторический период, подчеркивая важность личных отношений и социальных перемен.",12,3.5,898
156840,Тост,Русская классика,Александр Куприн,"жанр: классическая проза
темы: семья, взросление, внутренний конфликт
конфликт: противоречие между личными желаниями и семейными обязанностями.
смысл: Книга рассказывает о поисках героя в жизни и его борьбе с внутренними противоречиями.",15,4.0,898
86388,Тот самый Мюнхгаузен,"Пьесы и драматургия,Литература 20 века,Русская классика,Советская литература",Григорий Горин,"жанр: исторический роман
темы: история, прошлое, цивилизация, социальные процессы
конфликт: противоречие между реальностью и вымыслом, борьба за истину.
смысл: Книга представляет собой исторический роман, в котором автор использует вымысел для иллюстрации исторических событий и социальных процессов.",18,5.0,898
101775,Контракт 1884 года с Человечеством,"Литература 19 века,Русская классика",Антон Чехов,"жанр: классическая проза
темы: свобода, выбор, мораль
конфликт: противоречие между индивидуальной свободой и коллективными обязанностями.
смысл: Книга представляет собой философский анализ человеческой природы и ее взаимодействия с обществом.",21,5.0,898
98476,Корова,"Литература 19 века,Русская классика",Лев Толстой,"жанр: классическая проза
темы: семья, взросление, мораль
конфликт: противоречие между индивидуальными желаниями и общественными нормами.
смысл: книга исследует проблемы морали и взросления через призму жизни простого человека.",9,4.5,898
42630,Трущобные люди,"Литература 19 века,Русская классика",Владимир Гиляровский,"жанр: историческая проза
темы: городская жизнь, социальное неравенство, преступность
конфликт: противоречие между бедностью и преступностью, борьба за выживание в трущобах.
смысл: книга представляет собой портрет жизни людей в трущобах Москвы начала XX века, подчеркивая сложности и проблемы городской жизни.",6,2.0,898
172854,Трюм и палуба,"Литература 20 века,Русская классика",Александр Грин,"жанр: роман
темы: мораль, добро и зло, внутренний конфликт
конфликт: противоречие между моральными принципами и реальностью.
смысл: Книга исследует сложности человеческой природы и моральных дилемм.",11,5.0,898
134894,Тупейный художник,"Литература 19 века,Русская классика",Николай Лесков,"жанр: классическая проза
темы: жизнь, искусство, одиночество
конфликт: противоречие между творческим потенциалом и реальностью.
смысл: Книга рассказывает о сложностях человеческой жизни и поисках художника в поисках своего места в мире.",20,4.8,898
123807,Тьма египетская,"Литература 20 века,Русская классика",Михаил Булгаков,"жанр: исторический роман
темы: история, прошлое, религия, духовность
конфликт: противоречие между верой и реальностью, борьба за власть и влияние.
смысл: Книга рассказывает о жизни и борьбе человека в сложном историческом контексте, подчеркивая важность веры и духовности в поисках смысла и цели.",11,5.0,898
144868,Третий сын,"Литература 20 века,Русская классика,Советская литература",Андрей Платонов,"жанр: исторический роман
темы: семья, взросление, власть, коррупция
конфликт: противоречие между личными амбициями и общественными ожиданиями.
смысл: Книга рассказывает о сложностях человеческой жизни и борьбе за власть и признание.",13,5.0,898
31567,Крэнфорд,Русская классика,Элизабет Гаскелл,"жанр: роман
темы: семья, взросление, власть, социальное неравенство
конфликт: противоречие между стремлением к социальному статусу и личной свободой.
смысл: Книга Крэнфорд исследует сложности социального статуса и личной идентичности в викторианском обществе.",15,4.8,898
305081,Кувырков,"Литература 19 века,Русская классика",Николай Лесков,"жанр: классическая проза
темы: взросление, идентичность, психология личности
конфликт: противоречие между индивидуальностью и общественными нормами.
смысл: Книга исследует процесс формирования личности и поиска места в обществе.",13,5.0,898
80899,Кусок мяса,"Литература 20 века,Русская классика",Варлам Шаламов,"жанр: классическая проза
темы: одиночество, страдание, свобода
конфликт: противоречие между личной свободой и принудительной работой в лагере.
смысл: Книга рассказывает о жизни человека в лагере и его поисках свободы и человеческого достоинства.",16,5.0,898
133222,Куст сирени,"Зарубежная классика,Литература 19 века,Русская классика",Александр Куприн,"жанр: классическая проза
темы: семья, взросление, смерть, вина
конфликт: противоречие между прошлым и настоящим, внутренний конфликт главного героя.
смысл: Книга рассказывает о сложностях человеческой природы и о том, как прошлые ошибки могут повлиять на настоящее.",20,3.5,898
246840,Три дня в деревне,"Литература 20 века,Русская классика",Лев Толстой,"жанр: роман
темы: семья, взросление, мораль
конфликт: противоречие между индивидуальной свободой и социальными нормами.
смысл: Книга исследует проблемы морали и личного роста через историю человека, который проводит три дня в деревне.",13,3.5,898
106743,Три медведя,"Литература 19 века,Русская классика",Лев Толстой,"жанр: классическая проза
темы: семья, взросление, мораль
конфликт: противоречие между индивидуальными желаниями и семейными обязанностями.
смысл: Книга исследует проблемы морали и взросления через историю трех братьев, их отношений и принципов.",20,3.7,898
171228,Три смерти,"Литература 19 века,Русская классика",Лев Толстой,"жанр: классическая проза
темы: смерть, страдание, мораль
конфликт: противоречие между жизнью и смертью, моральными принципами и реальностью.
смысл: Книга исследует темы смерти, страдания и морали, подчеркивая важность поиска смысла в жизни.",7,,898
88707,Три старца,"Литература 19 века,Русская классика",Лев Толстой,"жанр: классическая проза
темы: семья, взросление, смысл жизни, власть, коррупция
конфликт: противоречие между старцами и их окружением, внутренний конфликт старцев.
смысл: Книга исследует проблемы человеческого существования, власти и морали, через призму жизни трех старцев.",12,5.0,898
294369,Крейцерова соната,"Литература 19 века,Русская классика",Лев Толстой,"жанр: роман
темы: семья, взросление, мораль
конфликт: противоречие между личными ценностями и общественными нормами.
смысл: Книга исследует сложности человеческого поведения и моральных принципов в сложных жизненных ситуациях.",46,5.0,898
259178,Крест,Русская классика,Варлам Шаламов,"жанр: классическая проза
темы: свобода, власть, коррупция, социальное неравенство
конфликт: противоречие между индивидуальной свободой и коллективной властью.
смысл: Книга ""Крест"" представляет собой критический взгляд на социальную систему и ее влияние на индивидуальность.",15,5.0,898
235346,Крестьянин Ягафар,"Литература 20 века,Русская классика,Советская литература,Книги о войне",Андрей Платонов,"жанр: исторический роман
темы: семья, взросление, власть, социальное неравенство
конфликт: противоречие между крестьянским укладом и властью помещиков.
смысл: Книга рассказывает о жизни крестьянского народа и его борьбе за выживание в условиях социального неравенства.",20,5.0,898
42146,Кроткая,"Литература 19 века,Русская классика",Федор Достоевский,"жанр: психологический роман
темы: семья, взросление, вина, смысл жизни
конфликт: противоречие между моральными принципами и реальностью.
смысл: Книга исследует проблемы человеческой природы и поиска смысла в жизни.",38,3.5,898
197774,Крупичатая,"Литература 19 века,Русская классика",Дмитрий Мамин-Сибиряк,"жанр: классическая проза
темы: семья, детство, взросление, смерть
конфликт: противоречие между прошлым и настоящим, борьба с потерей близких.
смысл: Книга рассказывает о сложностях человеческой жизни, о том, как люди сталкиваются с трудностями и преодолевает их.",11,4.0,898
134498,Крутой характер,Русская классика,Александр Куприн,"жанр: психологический роман
темы: внутренний конфликт, идентичность, психология личности
конфликт: противоречие между индивидуальностью и общественными нормами.
смысл: Книга исследует сложности человеческой психики и поиск личности в противоречивом обществе.",12,5.0,898
196520,"Король, дама, валет","Литература 20 века,Русская классика",Владимир Набоков,"жанр: роман
темы: любовь, семья, взросление
конфликт: противоречие между индивидуальной свободой и социальными нормами.
смысл: книга исследует сложности человеческих отношений и поиска личной идентичности.",29,4.3,898
109406,Кошмар,"Литература 20 века,Русская классика",Александр Грин,"жанр: психологический роман
темы: одиночество, смерть, внутренний конфликт
конфликт: противоречие между реальностью и фантазиями главного героя.
смысл: Книга исследует темы одиночества и смерти, а также внутренний конфликт главного героя, который борется с реальностью и своей фантазией.",15,4.5,898
112539,Красный смех,"Литература 20 века,Русская классика",Леонид Андреев,"жанр: классическая проза
темы: смерть, страдание, вина
конфликт: противоречие между моралью и реальностью, внутренний конфликт героя.
смысл: Книга исследует темы человеческого страдания и поиска смысла в жизни.",13,4.0,898
232010,Комик,"Литература 19 века,Русская классика",Алексей Писемский,"жанр: комик
темы: юмор, путешествия, отношения
конфликт: противоречие между желанием путешествовать и необходимостью поддерживать отношения.
смысл: книга рассказывает о приключениях и путешествиях, подчеркивая важность баланса между индивидуальными желаниями и социальными обязательствами.",14,4.0,898
4148,Кому в эмиграции жить хорошо,"Старинная литература,Русская классика",Саша Чёрный,"жанр: социальная фантастика
темы: эмиграция, свобода, идентичность
конфликт: противоречие между личными желаниями и общественными ожиданиями.
смысл: Книга исследует проблемы эмиграции и поиска личной свободы в новых условиях.",17,5.0,898
66412,Конармия,"Литература 20 века,Русская классика,Советская литература",Исаак Бабель,"жанр: исторический роман
темы: война, насилие, конфликт, выживание
конфликт: противоречие между человеческой жизнью и войной.
смысл: книга рассказывает о человеческих страданиях и выживании в условиях войны.",19,4.7,898
49976,Конец света,"Литература 19 века,Русская классика",Иван Тургенев,"жанр: исторический роман
темы: война, насилие, конфликт, выживание
конфликт: противоречие между индивидуальными интересами и коллективными нуждами, борьба за выживание в условиях опасности.
смысл: книга рассказывает о человеческих переживаниях и эмоциях в период войны и насилия, подчеркивая важность выживания и сопротивления.",21,5.0,898
220934,Cказки,"Старинная литература,Русская классика",Василий Жуковский,"жанр: классическая проза
темы: любовь, семья, детство
конфликт: внутренний конфликт, семейные проблемы
смысл: История о жизни и отношениях, исследование человеческих эмоций и опыта.",14,5.0,898
288406,«Блуждающие звезды». Рассказ для кино,"Литература 20 века,Русская классика,Советская литература",Исаак Бабель,"жанр: рассказ
темы: любовь, семья, идентичность
конфликт: внутренний конфликт, конфликт поколений
смысл: История о поиске своего места в мире, о сложностях отношений и идентичности. Рассказывает о внутренних конфликтах и борьбе за самопознание.",13,4.5,898
157642,«Дубки»,"Литература 20 века,Русская классика",Иван Бунин,"жанр: рассказ
темы: любовь, семья, детство
конфликт: внутренний конфликт, конфликт поколений
смысл: История о взрослении и самопознании, исследование отношений и ценностей.",17,5.0,898
263004,«Илья Муромец»,"Литература 20 века,Русская классика",Саша Чёрный,"жанр: исторический роман
темы: героизм, честь, традиции
конфликт: внутренний конфликт, конфликт
смысл: История о герое, борьбе за справедливость, самопознании.",13,4.0,898
210721,Село Степанчиково и его обитатели,"Литература 19 века,Русская классика",Федор Достоевский,"жанр: классическая проза
темы: семья, взросление, власть, коррупция
конфликт: противоречие между властью и обществом, внутренний конфликт персонажей.
смысл: Книга исследует социальные проблемы и внутренние конфликты персонажей в небольшом русском селе.",17,5.0,898
168265,Семейная хроника,"Зарубежная классика,Литература 19 века,Русская классика",Сергей Аксаков,"жанр: историческая проза
темы: семья, детство, взросление, история
конфликт: противоречие между прошлым и настоящим, борьба за сохранение семейной традиции.
смысл: Книга представляет собой исторический отчет о жизни семьи, показывающий эволюцию отношений и ценностей через поколения.",23,,898
